# name: test/sql/vex/index/graph_index_invariant_stress.test_slow
# description: Stress test for index invariants — large data, repeated operations
# group: [vex]
#
# Non-deterministic bugs (like Vector format depending on pipeline scheduling)
# require repeated execution with varied data sizes to surface reliably.
# This test uses large batches and multiple rounds to maximize coverage.

require vex

# ============================================================
# Test 1: Repeated INSERT batches of varying sizes
# Pipeline segment count varies with batch size, changing Vector formats
# ============================================================

statement ok
CREATE TABLE t_stress1 (id INTEGER, vec FLOATVECTOR(8));

statement ok
CREATE INDEX idx_s1 ON t_stress1 USING GRAPH_INDEX (vec);

# Round 1: 500 rows
statement ok
INSERT INTO t_stress1 SELECT i, list_value(
  sin(i*0.01)::FLOAT, cos(i*0.02)::FLOAT, sin(i*0.03)::FLOAT, cos(i*0.04)::FLOAT,
  sin(i*0.05)::FLOAT, cos(i*0.06)::FLOAT, sin(i*0.07)::FLOAT, cos(i*0.08)::FLOAT
)::FLOATVECTOR(8)
FROM range(1, 501) t(i);

query I
SELECT node_count <= row_id_map_size FROM vex_index_info() WHERE index_name = 'idx_s1';
----
true

# Round 2: 300 rows
statement ok
INSERT INTO t_stress1 SELECT i, list_value(
  cos(i*0.01)::FLOAT, sin(i*0.02)::FLOAT, cos(i*0.03)::FLOAT, sin(i*0.04)::FLOAT,
  cos(i*0.05)::FLOAT, sin(i*0.06)::FLOAT, cos(i*0.07)::FLOAT, sin(i*0.08)::FLOAT
)::FLOATVECTOR(8)
FROM range(501, 801) t(i);

query I
SELECT node_count <= row_id_map_size FROM vex_index_info() WHERE index_name = 'idx_s1';
----
true

# Round 3: small batch — 10 rows
statement ok
INSERT INTO t_stress1 SELECT i, list_value(
  0.0, 0.0, 0.0, 0.0, sin(i)::FLOAT, cos(i)::FLOAT, 0.0, 0.0
)::FLOATVECTOR(8)
FROM range(801, 811) t(i);

query I
SELECT node_count <= row_id_map_size FROM vex_index_info() WHERE index_name = 'idx_s1';
----
true

# Round 4: 1000 rows (large batch, likely multi-segment pipeline)
statement ok
INSERT INTO t_stress1 SELECT i, list_value(
  sin(i*0.1)::FLOAT, cos(i*0.1)::FLOAT, sin(i*0.2)::FLOAT, cos(i*0.2)::FLOAT,
  sin(i*0.3)::FLOAT, cos(i*0.3)::FLOAT, sin(i*0.4)::FLOAT, cos(i*0.4)::FLOAT
)::FLOATVECTOR(8)
FROM range(811, 1811) t(i);

query I
SELECT node_count <= row_id_map_size FROM vex_index_info() WHERE index_name = 'idx_s1';
----
true

query I
SELECT count(*) FROM t_stress1;
----
1810

query I
SELECT count(*) FROM (SELECT id FROM t_stress1 ORDER BY l2_distance(vec, [0.0,0.0,0.0,0.0,0.0,0.0,0.0,0.0]::FLOATVECTOR(8)) LIMIT 50);
----
50

statement ok
DROP TABLE t_stress1;

# ============================================================
# Test 2: Mixed INSERT + DELETE cycles — verify invariant at each step
# ============================================================

statement ok
CREATE TABLE t_stress2 (id INTEGER, vec FLOATVECTOR(4));

statement ok
INSERT INTO t_stress2 SELECT i, list_value(
  sin(i*0.1)::FLOAT, cos(i*0.2)::FLOAT, sin(i*0.3)::FLOAT, cos(i*0.4)::FLOAT
)::FLOATVECTOR(4)
FROM range(1, 501) t(i);

statement ok
CREATE INDEX idx_s2 ON t_stress2 USING GRAPH_INDEX (vec);

query I
SELECT node_count <= row_id_map_size FROM vex_index_info() WHERE index_name = 'idx_s2';
----
true

# Cycle 1: DELETE 100, INSERT 200
statement ok
DELETE FROM t_stress2 WHERE id <= 100;

query I
SELECT node_count <= row_id_map_size FROM vex_index_info() WHERE index_name = 'idx_s2';
----
true

statement ok
INSERT INTO t_stress2 SELECT i, list_value(
  cos(i*0.1)::FLOAT, sin(i*0.2)::FLOAT, 0.0, 0.0
)::FLOATVECTOR(4)
FROM range(501, 701) t(i);

query I
SELECT node_count <= row_id_map_size FROM vex_index_info() WHERE index_name = 'idx_s2';
----
true

# Cycle 2: DELETE 200, INSERT 100
statement ok
DELETE FROM t_stress2 WHERE id BETWEEN 101 AND 300;

query I
SELECT node_count <= row_id_map_size FROM vex_index_info() WHERE index_name = 'idx_s2';
----
true

statement ok
INSERT INTO t_stress2 SELECT i, list_value(
  sin(i)::FLOAT, cos(i)::FLOAT, 0.1, 0.2
)::FLOATVECTOR(4)
FROM range(701, 801) t(i);

query I
SELECT node_count <= row_id_map_size FROM vex_index_info() WHERE index_name = 'idx_s2';
----
true

# Cycle 3: UPDATE (= DELETE + INSERT)
statement ok
UPDATE t_stress2 SET vec = [0.0, 0.0, 0.0, 0.0]::FLOATVECTOR(4) WHERE id BETWEEN 301 AND 400;

query I
SELECT node_count <= row_id_map_size FROM vex_index_info() WHERE index_name = 'idx_s2';
----
true

# Verify final state
query I
SELECT count(*) FROM (SELECT id FROM t_stress2 ORDER BY l2_distance(vec, [0.0,0.0,0.0,0.0]::FLOATVECTOR(4)) LIMIT 20);
----
20

statement ok
DROP TABLE t_stress2;

# ============================================================
# Test 3: Self-search at scale — verify ALL 500 rows find themselves
# If even 1 row is an orphan node, this test will fail.
# ============================================================

statement ok
CREATE TABLE t_self500 (id INTEGER, vec FLOATVECTOR(4));

# Use widely spaced vectors so each is unambiguously its own nearest neighbor
statement ok
INSERT INTO t_self500 SELECT i, list_value(
  (i * 1000.0)::FLOAT, 0.0, 0.0, 0.0
)::FLOATVECTOR(4)
FROM range(1, 501) t(i);

statement ok
CREATE INDEX idx_self500 ON t_self500 USING GRAPH_INDEX (vec);

# Invariant check
query I
SELECT node_count <= row_id_map_size FROM vex_index_info() WHERE index_name = 'idx_self500';
----
true

# Every single row must find itself as top-1 nearest neighbor
# This query returns the count of rows where self-search succeeded
query I
SELECT count(*) FROM (
  SELECT t.id, (
    SELECT s.id FROM t_self500 s
    ORDER BY l2_distance(s.vec, t.vec)
    LIMIT 1
  ) as found_id
  FROM t_self500 t
) sub
WHERE sub.id = sub.found_id;
----
500

statement ok
DROP TABLE t_self500;

# ============================================================
# Test 4: Restart + invariant — the combination that exposed the
# row_id_map serialization bug AND the Flatten bug together
# ============================================================

load __TEST_DIR__/invariant_restart.db

statement ok
CREATE TABLE t_restart_inv (id INTEGER, vec FLOATVECTOR(4));

statement ok
INSERT INTO t_restart_inv SELECT i, list_value(
  sin(i*0.1)::FLOAT, cos(i*0.2)::FLOAT, sin(i*0.3)::FLOAT, cos(i*0.4)::FLOAT
)::FLOATVECTOR(4)
FROM range(1, 301) t(i);

statement ok
CREATE INDEX idx_ri ON t_restart_inv USING GRAPH_INDEX (vec);

query I
SELECT node_count <= row_id_map_size FROM vex_index_info() WHERE index_name = 'idx_ri';
----
true

statement ok
CHECKPOINT;

restart

# After restart: INSERT 200 rows → exercises both deserialized row_id_map AND Flatten
statement ok
INSERT INTO t_restart_inv SELECT i, list_value(
  cos(i*0.1)::FLOAT, sin(i*0.2)::FLOAT, cos(i*0.3)::FLOAT, sin(i*0.4)::FLOAT
)::FLOATVECTOR(4)
FROM range(301, 501) t(i);

query I
SELECT node_count <= row_id_map_size FROM vex_index_info() WHERE index_name = 'idx_ri';
----
true

# DELETE 100 rows → exercises row_id_map lookup on mixed (deserialized + new) entries
statement ok
DELETE FROM t_restart_inv WHERE id <= 100;

query I
SELECT node_count <= row_id_map_size FROM vex_index_info() WHERE index_name = 'idx_ri';
----
true

# UPDATE 50 rows → DELETE old + INSERT new
statement ok
UPDATE t_restart_inv SET vec = [0.0, 0.0, 0.0, 0.0]::FLOATVECTOR(4) WHERE id BETWEEN 101 AND 150;

query I
SELECT node_count <= row_id_map_size FROM vex_index_info() WHERE index_name = 'idx_ri';
----
true

query I
SELECT count(*) FROM t_restart_inv;
----
400

query I
SELECT count(*) FROM (SELECT id FROM t_restart_inv ORDER BY l2_distance(vec, [0.0,0.0,0.0,0.0]::FLOATVECTOR(4)) LIMIT 20);
----
20

statement ok
DROP TABLE t_restart_inv;
