# name: test/sql/vex/index/graph_index_memory_leak.test
# description: Verify no memory leak — FreeNode returns segments to allocator for reuse
# group: [vex]

require vex

# ============================================================
# Test 1: Insert-delete-reinsert cycle — memory should not grow unbounded
# If FreeNode doesn't work, each cycle allocates new segments without freeing old ones.
# After several cycles the memory would explode. We verify by doing 3 cycles on same index.
# ============================================================

statement ok
CREATE TABLE leak1 (id INTEGER, vec FLOATVECTOR(8));

statement ok
CREATE INDEX lidx1 ON leak1 USING GRAPH_INDEX (vec);

# Cycle 1: insert 200 rows
statement ok
INSERT INTO leak1 SELECT i, list_value(
  sin(i*0.1)::FLOAT, cos(i*0.2)::FLOAT, sin(i*0.3)::FLOAT, cos(i*0.4)::FLOAT,
  sin(i*0.5)::FLOAT, cos(i*0.6)::FLOAT, sin(i*0.7)::FLOAT, cos(i*0.8)::FLOAT
)::FLOATVECTOR(8)
FROM range(1, 201) t(i);

query I
SELECT count(*) FROM leak1;
----
200

# Delete all
statement ok
DELETE FROM leak1;

query I
SELECT count(*) FROM leak1;
----
0

# Cycle 2: insert 200 more (should reuse freed segments, not allocate new)
statement ok
INSERT INTO leak1 SELECT i, list_value(
  cos(i*0.1)::FLOAT, sin(i*0.2)::FLOAT, cos(i*0.3)::FLOAT, sin(i*0.4)::FLOAT,
  cos(i*0.5)::FLOAT, sin(i*0.6)::FLOAT, cos(i*0.7)::FLOAT, sin(i*0.8)::FLOAT
)::FLOATVECTOR(8)
FROM range(201, 401) t(i);

query I
SELECT count(*) FROM (SELECT id FROM leak1 ORDER BY l2_distance(vec, [0.0,0.0,0.0,0.0,0.0,0.0,0.0,0.0]::FLOATVECTOR(8)) LIMIT 10);
----
10

# Delete all again
statement ok
DELETE FROM leak1;

# Cycle 3: insert 200 more
statement ok
INSERT INTO leak1 SELECT i, list_value(
  sin(i*0.2)::FLOAT, cos(i*0.3)::FLOAT, sin(i*0.4)::FLOAT, cos(i*0.5)::FLOAT,
  sin(i*0.6)::FLOAT, cos(i*0.7)::FLOAT, sin(i*0.8)::FLOAT, cos(i*0.9)::FLOAT
)::FLOATVECTOR(8)
FROM range(401, 601) t(i);

query I
SELECT count(*) FROM (SELECT id FROM leak1 ORDER BY l2_distance(vec, [0.0,0.0,0.0,0.0,0.0,0.0,0.0,0.0]::FLOATVECTOR(8)) LIMIT 10);
----
10

statement ok
DROP TABLE leak1;

# ============================================================
# Test 2: Partial delete + reinsert — freed segments reused
# ============================================================

statement ok
CREATE TABLE leak2 (id INTEGER, vec FLOATVECTOR(4));

statement ok
CREATE INDEX lidx2 ON leak2 USING GRAPH_INDEX (vec);

statement ok
INSERT INTO leak2 SELECT i, list_value(sin(i)::FLOAT, cos(i)::FLOAT, 0.0, 0.0)::FLOATVECTOR(4)
FROM range(1, 101) t(i);

# Delete half
statement ok
DELETE FROM leak2 WHERE id <= 50;

query I
SELECT count(*) FROM leak2;
----
50

# Insert same amount back
statement ok
INSERT INTO leak2 SELECT i, list_value(sin(i)::FLOAT, cos(i)::FLOAT, 0.5, 0.5)::FLOATVECTOR(4)
FROM range(101, 151) t(i);

query I
SELECT count(*) FROM leak2;
----
100

# All 100 searchable
query I
SELECT count(*) FROM (SELECT id FROM leak2 ORDER BY l2_distance(vec, [0.0,0.0,0.0,0.0]::FLOATVECTOR(4)) LIMIT 20);
----
20

# Delete all, reinsert, verify
statement ok
DELETE FROM leak2;

statement ok
INSERT INTO leak2 SELECT i, list_value(sin(i)::FLOAT, cos(i)::FLOAT, 1.0, 1.0)::FLOATVECTOR(4)
FROM range(151, 251) t(i);

query I
SELECT count(*) FROM (SELECT id FROM leak2 ORDER BY l2_distance(vec, [0.0,0.0,0.0,0.0]::FLOATVECTOR(4)) LIMIT 10);
----
10

statement ok
DROP TABLE leak2;

# ============================================================
# Test 3: HybridIndex — delete partition, reinsert, verify no leak
# ============================================================

statement ok
CREATE TABLE leak3 (id INTEGER, cat VARCHAR, vec FLOATVECTOR(4));

statement ok
CREATE INDEX lidx3 ON leak3 USING HYBRID_INDEX (vec, cat);

statement ok
INSERT INTO leak3 SELECT i, 'a', list_value(sin(i)::FLOAT, cos(i)::FLOAT, 0.0, 0.0)::FLOATVECTOR(4)
FROM range(1, 101) t(i);

statement ok
INSERT INTO leak3 SELECT i, 'b', list_value(cos(i)::FLOAT, sin(i)::FLOAT, 0.0, 0.0)::FLOATVECTOR(4)
FROM range(101, 201) t(i);

# Delete entire partition 'a'
statement ok
DELETE FROM leak3 WHERE cat = 'a';

# Reinsert into 'a'
statement ok
INSERT INTO leak3 SELECT i, 'a', list_value(sin(i*0.5)::FLOAT, cos(i*0.5)::FLOAT, 0.5, 0.5)::FLOATVECTOR(4)
FROM range(201, 301) t(i);

# Both partitions functional
query I
SELECT count(*) FROM (SELECT id FROM leak3 WHERE cat = 'a' ORDER BY l2_distance(vec, [0.0,0.0,0.0,0.0]::FLOATVECTOR(4)) LIMIT 10);
----
10

query I
SELECT count(*) FROM (SELECT id FROM leak3 WHERE cat = 'b' ORDER BY l2_distance(vec, [0.0,0.0,0.0,0.0]::FLOATVECTOR(4)) LIMIT 10);
----
10

# Delete-reinsert cycle on partition 'b'
statement ok
DELETE FROM leak3 WHERE cat = 'b';

statement ok
INSERT INTO leak3 SELECT i, 'b', list_value(0.0, 0.0, sin(i)::FLOAT, cos(i)::FLOAT)::FLOATVECTOR(4)
FROM range(301, 401) t(i);

query I
SELECT count(*) FROM (SELECT id FROM leak3 WHERE cat = 'b' ORDER BY l2_distance(vec, [0.0,0.0,0.0,0.0]::FLOATVECTOR(4)) LIMIT 10);
----
10

statement ok
DROP TABLE leak3;

# ============================================================
# Test 4: Persistence after delete-reinsert — verify no leaked segments on disk
# ============================================================

load __TEST_DIR__/leak_persist.db

statement ok
CREATE TABLE leak4 (id INTEGER, vec FLOATVECTOR(4));

statement ok
CREATE INDEX lidx4 ON leak4 USING GRAPH_INDEX (vec);

# Insert 100, delete all, insert 100 again
statement ok
INSERT INTO leak4 SELECT i, list_value(sin(i)::FLOAT, cos(i)::FLOAT, 0.0, 0.0)::FLOATVECTOR(4)
FROM range(1, 101) t(i);

statement ok
DELETE FROM leak4;

statement ok
INSERT INTO leak4 SELECT i, list_value(cos(i)::FLOAT, sin(i)::FLOAT, 0.5, 0.5)::FLOATVECTOR(4)
FROM range(101, 201) t(i);

statement ok
CHECKPOINT;

restart

query I
SELECT count(*) FROM leak4;
----
100

query I
SELECT count(*) FROM (SELECT id FROM leak4 ORDER BY l2_distance(vec, [0.0,0.0,0.0,0.0]::FLOATVECTOR(4)) LIMIT 10);
----
10

statement ok
DROP TABLE leak4;
