# name: test/sql/vex/index/graph_index_review_fixes.test
# description: Tests for code review fixes — edge cases previously uncovered
# group: [vex]
#
# Why existing tests didn't catch these:
# - Tests only verified row_id ordering, never checked distance values
# - No PQ + cosine/IP combination tests
# - HybridIndex GlobalSearch (cross-partition merge) never exercised
# - Small data sizes never triggered high HNSW levels
# - Single-threaded unittest didn't expose lock issues

require vex

# ============================================================
# Test 1: PQ + cosine metric should fall back to exact search
# (Previously PQ hardcoded L2, producing wrong results for cosine)
# ============================================================

statement ok
CREATE TABLE t_pq_cos (id INTEGER, vec FLOAT[8]);

statement ok
INSERT INTO t_pq_cos SELECT i, list_value(
  sin(i*0.1)::FLOAT, cos(i*0.1)::FLOAT,
  sin(i*0.2)::FLOAT, cos(i*0.2)::FLOAT,
  sin(i*0.3)::FLOAT, cos(i*0.3)::FLOAT,
  sin(i*0.4)::FLOAT, cos(i*0.4)::FLOAT
)::FLOAT[8]
FROM range(1, 201) t(i);

statement ok
CREATE INDEX idx_pq_cos ON t_pq_cos USING GRAPH_INDEX (vec)
    WITH (metric='cosine', quantizer='pq', pq_m=4);

# Self-search: cosine distance to itself = 0, should find itself as top-1
query I
SELECT count(*) FROM (
  SELECT t.id, (
    SELECT s.id FROM t_pq_cos s
    ORDER BY cosine_distance(s.vec, t.vec)
    LIMIT 1
  ) as found_id
  FROM t_pq_cos t
  WHERE t.id <= 20
) sub
WHERE sub.id = sub.found_id;
----
20

query I
SELECT node_count <= row_id_map_size FROM vex_index_info() WHERE index_name = 'idx_pq_cos';
----
true

statement ok
DROP TABLE t_pq_cos;

# ============================================================
# Test 2: PQ + inner product should fall back to exact search
# ============================================================

statement ok
CREATE TABLE t_pq_ip (id INTEGER, vec FLOAT[8]);

statement ok
INSERT INTO t_pq_ip SELECT i, list_value(
  (i * sin(i*0.1))::FLOAT, (i * cos(i*0.1))::FLOAT,
  (i * sin(i*0.2))::FLOAT, (i * cos(i*0.2))::FLOAT,
  (i * sin(i*0.3))::FLOAT, (i * cos(i*0.3))::FLOAT,
  (i * sin(i*0.4))::FLOAT, (i * cos(i*0.4))::FLOAT
)::FLOAT[8]
FROM range(1, 201) t(i);

statement ok
CREATE INDEX idx_pq_ip ON t_pq_ip USING GRAPH_INDEX (vec)
    WITH (metric='ip', quantizer='pq', pq_m=4);

# Search should work correctly (PQ skipped, exact search used)
query I
SELECT count(*) FROM (
  SELECT id FROM t_pq_ip
  ORDER BY inner_product(vec, [1.0,1.0,1.0,1.0,1.0,1.0,1.0,1.0]::FLOAT[8]) DESC
  LIMIT 10
);
----
10

statement ok
DROP TABLE t_pq_ip;

# ============================================================
# Test 3: HybridIndex GlobalSearch — multi-partition IP merge
# (Previously: GlobalSearch always sorted ascending, correct for
#  NegativeIPDistance but never verified across partitions)
# ============================================================

statement ok
CREATE TABLE t_hyb_global (id INTEGER, cat VARCHAR, vec FLOAT[4]);

statement ok
CREATE INDEX idx_hyb_global ON t_hyb_global USING HYBRID_INDEX (vec, cat) WITH (metric='ip');

# Insert into multiple partitions
statement ok
INSERT INTO t_hyb_global SELECT i, 'part_a', list_value(
  (i * 10.0)::FLOAT, 0.0, 0.0, 0.0
)::FLOAT[4]
FROM range(1, 51) t(i);

statement ok
INSERT INTO t_hyb_global SELECT i, 'part_b', list_value(
  0.0, (i * 10.0)::FLOAT, 0.0, 0.0
)::FLOAT[4]
FROM range(51, 101) t(i);

# Invariant check
query I
SELECT bool_and(node_count <= row_id_map_size) FROM vex_index_info() WHERE index_name = 'idx_hyb_global';
----
true

# Unfiltered IP search across partitions — should find highest IP vectors
# Query [1,0,0,0]: part_a has high IP, part_b has IP=0
# Top result should be from part_a (id=50, ip=500)
query I
SELECT count(*) FROM (
  SELECT id FROM t_hyb_global
  ORDER BY inner_product(vec, [1.0, 0.0, 0.0, 0.0]::FLOAT[4]) DESC
  LIMIT 10
);
----
10

# Filtered search still works
query I
SELECT count(*) FROM (
  SELECT id FROM t_hyb_global
  WHERE cat = 'part_b'
  ORDER BY inner_product(vec, [0.0, 1.0, 0.0, 0.0]::FLOAT[4]) DESC
  LIMIT 5
);
----
5

statement ok
DROP TABLE t_hyb_global;

# ============================================================
# Test 4: HybridIndex cosine with multi-partition merge
# ============================================================

statement ok
CREATE TABLE t_hyb_cos_merge (id INTEGER, cat VARCHAR, vec FLOAT[4]);

statement ok
CREATE INDEX idx_hyb_cos_merge ON t_hyb_cos_merge USING HYBRID_INDEX (vec, cat) WITH (metric='cosine');

statement ok
INSERT INTO t_hyb_cos_merge SELECT i, 'x', list_value(
  (i * cos(i*0.1))::FLOAT, (i * sin(i*0.1))::FLOAT, 0.0, 0.0
)::FLOAT[4]
FROM range(1, 51) t(i);

statement ok
INSERT INTO t_hyb_cos_merge SELECT i, 'y', list_value(
  0.0, 0.0, (i * cos(i*0.1))::FLOAT, (i * sin(i*0.1))::FLOAT
)::FLOAT[4]
FROM range(51, 101) t(i);

# Unfiltered cosine search across partitions
query I
SELECT count(*) FROM (
  SELECT id FROM t_hyb_cos_merge
  ORDER BY cosine_distance(vec, [1.0, 0.0, 0.0, 0.0]::FLOAT[4])
  LIMIT 10
);
----
10

# Closest to [1,0,0,0] should be from partition 'x'
query I
SELECT cat FROM t_hyb_cos_merge
ORDER BY cosine_distance(vec, [1.0, 0.0, 0.0, 0.0]::FLOAT[4])
LIMIT 1;
----
x

statement ok
DROP TABLE t_hyb_cos_merge;

# ============================================================
# Test 5: Small M value — verifies level capping works
# (Previously HNSW_MAX_UPPER_LEVELS=8 but GetMaxLevel=32,
#  with M=2 level 9+ was reachable and caused overflow)
# ============================================================

statement ok
CREATE TABLE t_small_m (id INTEGER, vec FLOAT[4]);

statement ok
INSERT INTO t_small_m SELECT i, list_value(
  sin(i*0.1)::FLOAT, cos(i*0.1)::FLOAT,
  sin(i*0.2)::FLOAT, cos(i*0.2)::FLOAT
)::FLOAT[4]
FROM range(1, 501) t(i);

# M=2 gives ml=1/ln(2)≈1.44, level 8 probability ≈ e^(-8/1.44) ≈ 0.004
# With 500 nodes, ~2 nodes will reach level 8. Level cap prevents overflow.
statement ok
CREATE INDEX idx_small_m ON t_small_m USING GRAPH_INDEX (vec) WITH (m=2);

query I
SELECT node_count <= row_id_map_size FROM vex_index_info() WHERE index_name = 'idx_small_m';
----
true

# Search still works with small M
query I
SELECT count(*) FROM (
  SELECT id FROM t_small_m
  ORDER BY l2_distance(vec, [0.0, 1.0, 0.0, 0.0]::FLOAT[4])
  LIMIT 10
);
----
10

# DELETE + invariant
statement ok
DELETE FROM t_small_m WHERE id <= 100;

query I
SELECT node_count <= row_id_map_size FROM vex_index_info() WHERE index_name = 'idx_small_m';
----
true

statement ok
DROP TABLE t_small_m;

# ============================================================
# Test 6: <~> operator with index optimization
# (Verifies negative inner product operator works through
#  optimizer path with IP index)
# ============================================================

statement ok
CREATE TABLE t_nip_opt (id INTEGER, vec FLOAT[4]);

statement ok
INSERT INTO t_nip_opt VALUES
  (1, [10.0, 0.0, 0.0, 0.0]::FLOAT[4]),
  (2, [5.0, 0.0, 0.0, 0.0]::FLOAT[4]),
  (3, [1.0, 0.0, 0.0, 0.0]::FLOAT[4]),
  (4, [0.0, 1.0, 0.0, 0.0]::FLOAT[4]),
  (5, [-1.0, 0.0, 0.0, 0.0]::FLOAT[4]);

statement ok
CREATE INDEX idx_nip ON t_nip_opt USING GRAPH_INDEX (vec) WITH (metric='ip');

# <~> returns -inner_product, smaller = higher IP
# Query [1,0,0,0]: id=1(-10), id=2(-5), id=3(-1), id=4(0), id=5(1)
query I
SELECT id FROM t_nip_opt ORDER BY vec <~> [1.0, 0.0, 0.0, 0.0]::FLOAT[4] LIMIT 3;
----
1
2
3

statement ok
DROP TABLE t_nip_opt;

# ============================================================
# Test 7: Cosine metric with M=2 — combined edge case
# ============================================================

statement ok
CREATE TABLE t_cos_m2 (id INTEGER, vec FLOAT[4]);

statement ok
INSERT INTO t_cos_m2 SELECT i, list_value(
  (100.0 * cos(i * 0.3))::FLOAT,
  (100.0 * sin(i * 0.3))::FLOAT,
  (100.0 * cos(i * 0.7))::FLOAT,
  (100.0 * sin(i * 0.7))::FLOAT
)::FLOAT[4]
FROM range(1, 201) t(i);

statement ok
CREATE INDEX idx_cos_m2 ON t_cos_m2 USING GRAPH_INDEX (vec) WITH (metric='cosine', m=2);

query I
SELECT node_count <= row_id_map_size FROM vex_index_info() WHERE index_name = 'idx_cos_m2';
----
true

# Search works
query I
SELECT count(*) FROM (
  SELECT id FROM t_cos_m2
  ORDER BY cosine_distance(vec, [1.0, 0.0, 0.0, 0.0]::FLOAT[4])
  LIMIT 10
);
----
10

# DELETE + INSERT
statement ok
DELETE FROM t_cos_m2 WHERE id <= 50;

statement ok
INSERT INTO t_cos_m2 SELECT i, list_value(
  cos(i*0.1)::FLOAT, sin(i*0.1)::FLOAT, 0.0, 0.0
)::FLOAT[4]
FROM range(201, 251) t(i);

query I
SELECT node_count <= row_id_map_size FROM vex_index_info() WHERE index_name = 'idx_cos_m2';
----
true

statement ok
DROP TABLE t_cos_m2;

# ============================================================
# Test 8: Restart persistence with PQ + L2 (PQ should work for L2)
# ============================================================

load __TEST_DIR__/pq_l2_restart.db

statement ok
CREATE TABLE t_pq_l2 (id INTEGER, vec FLOAT[8]);

statement ok
INSERT INTO t_pq_l2 SELECT i, list_value(
  sin(i*0.1)::FLOAT, cos(i*0.1)::FLOAT,
  sin(i*0.2)::FLOAT, cos(i*0.2)::FLOAT,
  sin(i*0.3)::FLOAT, cos(i*0.3)::FLOAT,
  sin(i*0.4)::FLOAT, cos(i*0.4)::FLOAT
)::FLOAT[8]
FROM range(1, 201) t(i);

statement ok
CREATE INDEX idx_pq_l2 ON t_pq_l2 USING GRAPH_INDEX (vec)
    WITH (quantizer='pq', pq_m=4);

query I
SELECT count(*) FROM (
  SELECT id FROM t_pq_l2
  ORDER BY l2_distance(vec, [1.0,0.0,1.0,0.0,1.0,0.0,1.0,0.0]::FLOAT[8])
  LIMIT 10
);
----
10

statement ok
CHECKPOINT;

restart

# PQ search after restart
query I
SELECT count(*) FROM (
  SELECT id FROM t_pq_l2
  ORDER BY l2_distance(vec, [1.0,0.0,1.0,0.0,1.0,0.0,1.0,0.0]::FLOAT[8])
  LIMIT 10
);
----
10

statement ok
DROP TABLE t_pq_l2;
