# name: test/sql/vex/index/graph_index_restart_large.test_slow
# description: Large dataset restart — test row_id_map BLOB serialization at scale
# group: [vex]
#
# With 5000+ rows, the row_id_map BLOB becomes substantial (~80KB+).
# Verifies serialization/deserialization handles large BLOBs correctly.

require vex

load __TEST_DIR__/restart_large.db

statement ok
CREATE TABLE big (id INTEGER, vec FLOAT[8]);

statement ok
INSERT INTO big SELECT i, list_value(
  sin(i*0.01)::FLOAT, cos(i*0.02)::FLOAT, sin(i*0.03)::FLOAT, cos(i*0.04)::FLOAT,
  sin(i*0.05)::FLOAT, cos(i*0.06)::FLOAT, sin(i*0.07)::FLOAT, cos(i*0.08)::FLOAT
)::FLOAT[8]
FROM range(1, 5001) t(i);

statement ok
CREATE INDEX idx_big ON big USING GRAPH_INDEX (vec);

# Verify pre-restart
query I
SELECT count(*) FROM big;
----
5000

query I
SELECT count(*) FROM (SELECT id FROM big ORDER BY l2_distance(vec, [0.0,0.0,0.0,0.0,0.0,0.0,0.0,0.0]::FLOAT[8]) LIMIT 20);
----
20

statement ok
CHECKPOINT;

restart

# Trigger binding
statement ok
DELETE FROM big WHERE id = -999;

query I
SELECT node_count > 0 FROM vex_index_info() WHERE index_name = 'idx_big';
----
true

query I
SELECT node_count <= row_id_map_size FROM vex_index_info() WHERE index_name = 'idx_big';
----
true

# DELETE 1000 rows
statement ok
DELETE FROM big WHERE id <= 1000;

query I
SELECT count(*) FROM big;
----
4000

query I
SELECT node_count <= row_id_map_size FROM vex_index_info() WHERE index_name = 'idx_big';
----
true

# Search still works
query I
SELECT count(*) FROM (SELECT id FROM big ORDER BY l2_distance(vec, [0.0,0.0,0.0,0.0,0.0,0.0,0.0,0.0]::FLOAT[8]) LIMIT 20);
----
20

# INSERT 2000 new rows
statement ok
INSERT INTO big SELECT i, list_value(
  cos(i*0.01)::FLOAT, sin(i*0.02)::FLOAT, cos(i*0.03)::FLOAT, sin(i*0.04)::FLOAT,
  cos(i*0.05)::FLOAT, sin(i*0.06)::FLOAT, cos(i*0.07)::FLOAT, sin(i*0.08)::FLOAT
)::FLOAT[8]
FROM range(5001, 7001) t(i);

query I
SELECT count(*) FROM big;
----
6000

query I
SELECT node_count <= row_id_map_size FROM vex_index_info() WHERE index_name = 'idx_big';
----
true

# Checkpoint with large modified row_id_map
statement ok
CHECKPOINT;

restart

statement ok
DELETE FROM big WHERE id = -999;

query I
SELECT node_count <= row_id_map_size FROM vex_index_info() WHERE index_name = 'idx_big';
----
true

query I
SELECT count(*) FROM (SELECT id FROM big ORDER BY l2_distance(vec, [1.0,1.0,1.0,1.0,1.0,1.0,1.0,1.0]::FLOAT[8]) LIMIT 20);
----
20

statement ok
DROP TABLE big;
