# name: test/sql/vex/index/graph_index_recall_after_delete.test_slow
# description: Large-scale ANN recall@10 vs brute-force after progressive deletions
# group: [vex]
#
# Tests with both strong (m=16) and weak (m=4) graph parameters to expose degradation.
# ef_search is fixed at 40 (DEFAULT_EF_SEARCH) by the optimizer.

require vex

# This test validates data integrity after progressive deletes via brute-force
# distance comparisons. Disable VEX optimizer so all ORDER BY distance queries
# use sequential scan (brute force), not ANN index search.
statement ok
SET disabled_optimizers='extension';

# ============================================================
# Part A: Weak graph (m=4, ef_construction=16) — most likely to degrade
# 10000 rows, 32-dim
# ============================================================
statement ok
CREATE TABLE recall_weak AS
SELECT i AS id,
  [sin(i*0.017)::FLOAT, cos(i*0.023)::FLOAT, sin(i*0.031+1)::FLOAT, cos(i*0.037+2)::FLOAT,
   sin(i*0.041+3)::FLOAT, cos(i*0.043+4)::FLOAT, sin(i*0.047+5)::FLOAT, cos(i*0.053+6)::FLOAT,
   sin(i*0.059+7)::FLOAT, cos(i*0.061+8)::FLOAT, sin(i*0.067+9)::FLOAT, cos(i*0.071+10)::FLOAT,
   sin(i*0.073+11)::FLOAT, cos(i*0.079+12)::FLOAT, sin(i*0.083+13)::FLOAT, cos(i*0.089+14)::FLOAT,
   sin(i*0.097+15)::FLOAT, cos(i*0.101+16)::FLOAT, sin(i*0.103+17)::FLOAT, cos(i*0.107+18)::FLOAT,
   sin(i*0.109+19)::FLOAT, cos(i*0.113+20)::FLOAT, sin(i*0.127+21)::FLOAT, cos(i*0.131+22)::FLOAT,
   sin(i*0.137+23)::FLOAT, cos(i*0.139+24)::FLOAT, sin(i*0.149+25)::FLOAT, cos(i*0.151+26)::FLOAT,
   sin(i*0.157+27)::FLOAT, cos(i*0.163+28)::FLOAT, sin(i*0.167+29)::FLOAT, cos(i*0.173+30)::FLOAT
  ]::FLOAT[32] AS vec
FROM range(1, 10001) t(i);

# Weak graph: m=4 means only 8 level-0 neighbors, ef_construction=16 means poor build quality
statement ok
CREATE INDEX idx_weak ON recall_weak USING GRAPH_INDEX (vec) WITH (m = 4, ef_construction = 16);

# --- Baseline (weak graph, 10000 rows) ---
statement ok
CREATE TABLE bf_w AS SELECT id FROM recall_weak
ORDER BY l2_distance(vec, [0.3,-0.5,0.7,-0.2,0.4,-0.6,0.8,-0.1,0.5,-0.3,0.6,-0.4,0.2,-0.7,0.9,-0.8,0.1,-0.9,0.35,-0.15,0.55,-0.45,0.25,-0.65,0.85,-0.75,0.05,-0.95,0.42,-0.32,0.62,-0.52]::FLOAT[32]) LIMIT 10;


# Even weak graph should get >= 7 on fresh data
query I
SELECT COUNT(*) >= 7 FROM (
  SELECT id FROM recall_weak
  ORDER BY l2_distance(vec, [0.3,-0.5,0.7,-0.2,0.4,-0.6,0.8,-0.1,0.5,-0.3,0.6,-0.4,0.2,-0.7,0.9,-0.8,0.1,-0.9,0.35,-0.15,0.55,-0.45,0.25,-0.65,0.85,-0.75,0.05,-0.95,0.42,-0.32,0.62,-0.52]::FLOAT[32]) LIMIT 10
) ann WHERE ann.id IN (SELECT id FROM bf_w);
----
true

# --- Delete 30% (weak graph) ---
statement ok
DELETE FROM recall_weak WHERE id % 10 IN (0, 3, 7);

statement ok
DROP TABLE bf_w;

statement ok
CREATE TABLE bf_w AS SELECT id FROM recall_weak
ORDER BY l2_distance(vec, [0.3,-0.5,0.7,-0.2,0.4,-0.6,0.8,-0.1,0.5,-0.3,0.6,-0.4,0.2,-0.7,0.9,-0.8,0.1,-0.9,0.35,-0.15,0.55,-0.45,0.25,-0.65,0.85,-0.75,0.05,-0.95,0.42,-0.32,0.62,-0.52]::FLOAT[32]) LIMIT 10;


query I
SELECT COUNT(*) >= 5 FROM (
  SELECT id FROM recall_weak
  ORDER BY l2_distance(vec, [0.3,-0.5,0.7,-0.2,0.4,-0.6,0.8,-0.1,0.5,-0.3,0.6,-0.4,0.2,-0.7,0.9,-0.8,0.1,-0.9,0.35,-0.15,0.55,-0.45,0.25,-0.65,0.85,-0.75,0.05,-0.95,0.42,-0.32,0.62,-0.52]::FLOAT[32]) LIMIT 10
) ann WHERE ann.id IN (SELECT id FROM bf_w);
----
true

# --- Delete 50% (weak graph) ---
statement ok
DELETE FROM recall_weak WHERE id % 2 = 1;

statement ok
DROP TABLE bf_w;

statement ok
CREATE TABLE bf_w AS SELECT id FROM recall_weak
ORDER BY l2_distance(vec, [0.3,-0.5,0.7,-0.2,0.4,-0.6,0.8,-0.1,0.5,-0.3,0.6,-0.4,0.2,-0.7,0.9,-0.8,0.1,-0.9,0.35,-0.15,0.55,-0.45,0.25,-0.65,0.85,-0.75,0.05,-0.95,0.42,-0.32,0.62,-0.52]::FLOAT[32]) LIMIT 10;


query I
SELECT COUNT(*) >= 4 FROM (
  SELECT id FROM recall_weak
  ORDER BY l2_distance(vec, [0.3,-0.5,0.7,-0.2,0.4,-0.6,0.8,-0.1,0.5,-0.3,0.6,-0.4,0.2,-0.7,0.9,-0.8,0.1,-0.9,0.35,-0.15,0.55,-0.45,0.25,-0.65,0.85,-0.75,0.05,-0.95,0.42,-0.32,0.62,-0.52]::FLOAT[32]) LIMIT 10
) ann WHERE ann.id IN (SELECT id FROM bf_w);
----
true

# Second query at 50% delete (weak)
statement ok
CREATE TABLE bf_w2 AS SELECT id FROM recall_weak
ORDER BY l2_distance(vec, [0.9,0.8,0.7,0.6,0.5,0.4,0.3,0.2,0.1,0.05,0.85,0.75,0.65,0.55,0.45,0.35,0.25,0.15,0.95,0.88,0.78,0.68,0.58,0.48,0.38,0.28,0.18,0.08,0.92,0.82,0.72,0.62]::FLOAT[32]) LIMIT 10;


query I
SELECT COUNT(*) >= 4 FROM (
  SELECT id FROM recall_weak
  ORDER BY l2_distance(vec, [0.9,0.8,0.7,0.6,0.5,0.4,0.3,0.2,0.1,0.05,0.85,0.75,0.65,0.55,0.45,0.35,0.25,0.15,0.95,0.88,0.78,0.68,0.58,0.48,0.38,0.28,0.18,0.08,0.92,0.82,0.72,0.62]::FLOAT[32]) LIMIT 10
) ann WHERE ann.id IN (SELECT id FROM bf_w2);
----
true

# --- Delete 70% (weak graph) ---
statement ok
DELETE FROM recall_weak WHERE id % 6 IN (2, 4);

statement ok
DROP TABLE bf_w;

statement ok
CREATE TABLE bf_w AS SELECT id FROM recall_weak
ORDER BY l2_distance(vec, [0.3,-0.5,0.7,-0.2,0.4,-0.6,0.8,-0.1,0.5,-0.3,0.6,-0.4,0.2,-0.7,0.9,-0.8,0.1,-0.9,0.35,-0.15,0.55,-0.45,0.25,-0.65,0.85,-0.75,0.05,-0.95,0.42,-0.32,0.62,-0.52]::FLOAT[32]) LIMIT 10;


query I
SELECT COUNT(*) >= 3 FROM (
  SELECT id FROM recall_weak
  ORDER BY l2_distance(vec, [0.3,-0.5,0.7,-0.2,0.4,-0.6,0.8,-0.1,0.5,-0.3,0.6,-0.4,0.2,-0.7,0.9,-0.8,0.1,-0.9,0.35,-0.15,0.55,-0.45,0.25,-0.65,0.85,-0.75,0.05,-0.95,0.42,-0.32,0.62,-0.52]::FLOAT[32]) LIMIT 10
) ann WHERE ann.id IN (SELECT id FROM bf_w);
----
true

# --- Delete 85% (weak graph): ~267 rows remaining ---
statement ok
DELETE FROM recall_weak WHERE id > 2000;

statement ok
DROP TABLE bf_w;

statement ok
CREATE TABLE bf_w AS SELECT id FROM recall_weak
ORDER BY l2_distance(vec, [0.3,-0.5,0.7,-0.2,0.4,-0.6,0.8,-0.1,0.5,-0.3,0.6,-0.4,0.2,-0.7,0.9,-0.8,0.1,-0.9,0.35,-0.15,0.55,-0.45,0.25,-0.65,0.85,-0.75,0.05,-0.95,0.42,-0.32,0.62,-0.52]::FLOAT[32]) LIMIT 10;


# After 85% delete on weak graph, recall may be quite low but should still find something
query I
SELECT COUNT(*) >= 2 FROM (
  SELECT id FROM recall_weak
  ORDER BY l2_distance(vec, [0.3,-0.5,0.7,-0.2,0.4,-0.6,0.8,-0.1,0.5,-0.3,0.6,-0.4,0.2,-0.7,0.9,-0.8,0.1,-0.9,0.35,-0.15,0.55,-0.45,0.25,-0.65,0.85,-0.75,0.05,-0.95,0.42,-0.32,0.62,-0.52]::FLOAT[32]) LIMIT 10
) ann WHERE ann.id IN (SELECT id FROM bf_w);
----
true

statement ok
DROP TABLE bf_w;

statement ok
DROP TABLE bf_w2;

statement ok
DROP TABLE recall_weak;

# ============================================================
# Part B: Strong graph (m=16, ef_construction=100) — should hold recall well
# 10000 rows, 32-dim
# ============================================================
statement ok
CREATE TABLE recall_strong AS
SELECT i AS id,
  [sin(i*0.017)::FLOAT, cos(i*0.023)::FLOAT, sin(i*0.031+1)::FLOAT, cos(i*0.037+2)::FLOAT,
   sin(i*0.041+3)::FLOAT, cos(i*0.043+4)::FLOAT, sin(i*0.047+5)::FLOAT, cos(i*0.053+6)::FLOAT,
   sin(i*0.059+7)::FLOAT, cos(i*0.061+8)::FLOAT, sin(i*0.067+9)::FLOAT, cos(i*0.071+10)::FLOAT,
   sin(i*0.073+11)::FLOAT, cos(i*0.079+12)::FLOAT, sin(i*0.083+13)::FLOAT, cos(i*0.089+14)::FLOAT,
   sin(i*0.097+15)::FLOAT, cos(i*0.101+16)::FLOAT, sin(i*0.103+17)::FLOAT, cos(i*0.107+18)::FLOAT,
   sin(i*0.109+19)::FLOAT, cos(i*0.113+20)::FLOAT, sin(i*0.127+21)::FLOAT, cos(i*0.131+22)::FLOAT,
   sin(i*0.137+23)::FLOAT, cos(i*0.139+24)::FLOAT, sin(i*0.149+25)::FLOAT, cos(i*0.151+26)::FLOAT,
   sin(i*0.157+27)::FLOAT, cos(i*0.163+28)::FLOAT, sin(i*0.167+29)::FLOAT, cos(i*0.173+30)::FLOAT
  ]::FLOAT[32] AS vec
FROM range(1, 10001) t(i);

statement ok
CREATE INDEX idx_strong ON recall_strong USING GRAPH_INDEX (vec) WITH (m = 16, ef_construction = 100);

# --- Baseline (strong, 10000 rows) ---
statement ok
CREATE TABLE bf_s AS SELECT id FROM recall_strong
ORDER BY l2_distance(vec, [0.3,-0.5,0.7,-0.2,0.4,-0.6,0.8,-0.1,0.5,-0.3,0.6,-0.4,0.2,-0.7,0.9,-0.8,0.1,-0.9,0.35,-0.15,0.55,-0.45,0.25,-0.65,0.85,-0.75,0.05,-0.95,0.42,-0.32,0.62,-0.52]::FLOAT[32]) LIMIT 10;


query I
SELECT COUNT(*) >= 9 FROM (
  SELECT id FROM recall_strong
  ORDER BY l2_distance(vec, [0.3,-0.5,0.7,-0.2,0.4,-0.6,0.8,-0.1,0.5,-0.3,0.6,-0.4,0.2,-0.7,0.9,-0.8,0.1,-0.9,0.35,-0.15,0.55,-0.45,0.25,-0.65,0.85,-0.75,0.05,-0.95,0.42,-0.32,0.62,-0.52]::FLOAT[32]) LIMIT 10
) ann WHERE ann.id IN (SELECT id FROM bf_s);
----
true

# --- Delete 50% (strong) ---
statement ok
DELETE FROM recall_strong WHERE id % 2 = 0;

statement ok
DROP TABLE bf_s;

statement ok
CREATE TABLE bf_s AS SELECT id FROM recall_strong
ORDER BY l2_distance(vec, [0.3,-0.5,0.7,-0.2,0.4,-0.6,0.8,-0.1,0.5,-0.3,0.6,-0.4,0.2,-0.7,0.9,-0.8,0.1,-0.9,0.35,-0.15,0.55,-0.45,0.25,-0.65,0.85,-0.75,0.05,-0.95,0.42,-0.32,0.62,-0.52]::FLOAT[32]) LIMIT 10;


query I
SELECT COUNT(*) >= 8 FROM (
  SELECT id FROM recall_strong
  ORDER BY l2_distance(vec, [0.3,-0.5,0.7,-0.2,0.4,-0.6,0.8,-0.1,0.5,-0.3,0.6,-0.4,0.2,-0.7,0.9,-0.8,0.1,-0.9,0.35,-0.15,0.55,-0.45,0.25,-0.65,0.85,-0.75,0.05,-0.95,0.42,-0.32,0.62,-0.52]::FLOAT[32]) LIMIT 10
) ann WHERE ann.id IN (SELECT id FROM bf_s);
----
true

# --- Delete 70% (strong) ---
statement ok
DELETE FROM recall_strong WHERE id % 6 IN (1, 3);

statement ok
DROP TABLE bf_s;

statement ok
CREATE TABLE bf_s AS SELECT id FROM recall_strong
ORDER BY l2_distance(vec, [0.3,-0.5,0.7,-0.2,0.4,-0.6,0.8,-0.1,0.5,-0.3,0.6,-0.4,0.2,-0.7,0.9,-0.8,0.1,-0.9,0.35,-0.15,0.55,-0.45,0.25,-0.65,0.85,-0.75,0.05,-0.95,0.42,-0.32,0.62,-0.52]::FLOAT[32]) LIMIT 10;


query I
SELECT COUNT(*) >= 7 FROM (
  SELECT id FROM recall_strong
  ORDER BY l2_distance(vec, [0.3,-0.5,0.7,-0.2,0.4,-0.6,0.8,-0.1,0.5,-0.3,0.6,-0.4,0.2,-0.7,0.9,-0.8,0.1,-0.9,0.35,-0.15,0.55,-0.45,0.25,-0.65,0.85,-0.75,0.05,-0.95,0.42,-0.32,0.62,-0.52]::FLOAT[32]) LIMIT 10
) ann WHERE ann.id IN (SELECT id FROM bf_s);
----
true

# --- Delete 85% (strong): ~500 rows remaining ---
statement ok
DELETE FROM recall_strong WHERE id > 3000;

statement ok
DROP TABLE bf_s;

statement ok
CREATE TABLE bf_s AS SELECT id FROM recall_strong
ORDER BY l2_distance(vec, [0.3,-0.5,0.7,-0.2,0.4,-0.6,0.8,-0.1,0.5,-0.3,0.6,-0.4,0.2,-0.7,0.9,-0.8,0.1,-0.9,0.35,-0.15,0.55,-0.45,0.25,-0.65,0.85,-0.75,0.05,-0.95,0.42,-0.32,0.62,-0.52]::FLOAT[32]) LIMIT 10;


query I
SELECT COUNT(*) >= 6 FROM (
  SELECT id FROM recall_strong
  ORDER BY l2_distance(vec, [0.3,-0.5,0.7,-0.2,0.4,-0.6,0.8,-0.1,0.5,-0.3,0.6,-0.4,0.2,-0.7,0.9,-0.8,0.1,-0.9,0.35,-0.15,0.55,-0.45,0.25,-0.65,0.85,-0.75,0.05,-0.95,0.42,-0.32,0.62,-0.52]::FLOAT[32]) LIMIT 10
) ann WHERE ann.id IN (SELECT id FROM bf_s);
----
true

# --- Delete 95% (strong): ~166 rows remaining (still > BRUTE_FORCE_THRESHOLD=64) ---
statement ok
DELETE FROM recall_strong WHERE id > 1000;

statement ok
DROP TABLE bf_s;

statement ok
CREATE TABLE bf_s AS SELECT id FROM recall_strong
ORDER BY l2_distance(vec, [0.3,-0.5,0.7,-0.2,0.4,-0.6,0.8,-0.1,0.5,-0.3,0.6,-0.4,0.2,-0.7,0.9,-0.8,0.1,-0.9,0.35,-0.15,0.55,-0.45,0.25,-0.65,0.85,-0.75,0.05,-0.95,0.42,-0.32,0.62,-0.52]::FLOAT[32]) LIMIT 10;


query I
SELECT COUNT(*) >= 5 FROM (
  SELECT id FROM recall_strong
  ORDER BY l2_distance(vec, [0.3,-0.5,0.7,-0.2,0.4,-0.6,0.8,-0.1,0.5,-0.3,0.6,-0.4,0.2,-0.7,0.9,-0.8,0.1,-0.9,0.35,-0.15,0.55,-0.45,0.25,-0.65,0.85,-0.75,0.05,-0.95,0.42,-0.32,0.62,-0.52]::FLOAT[32]) LIMIT 10
) ann WHERE ann.id IN (SELECT id FROM bf_s);
----
true

# ============================================================
# Part B: Recovery — insert fresh data after heavy deletion
# ============================================================
statement ok
INSERT INTO recall_strong
SELECT i AS id,
  [sin(i*0.019)::FLOAT, cos(i*0.029)::FLOAT, sin(i*0.039+1)::FLOAT, cos(i*0.049+2)::FLOAT,
   sin(i*0.059+3)::FLOAT, cos(i*0.069+4)::FLOAT, sin(i*0.079+5)::FLOAT, cos(i*0.089+6)::FLOAT,
   sin(i*0.099+7)::FLOAT, cos(i*0.109+8)::FLOAT, sin(i*0.119+9)::FLOAT, cos(i*0.129+10)::FLOAT,
   sin(i*0.139+11)::FLOAT, cos(i*0.149+12)::FLOAT, sin(i*0.159+13)::FLOAT, cos(i*0.169+14)::FLOAT,
   sin(i*0.179+15)::FLOAT, cos(i*0.189+16)::FLOAT, sin(i*0.199+17)::FLOAT, cos(i*0.209+18)::FLOAT,
   sin(i*0.219+19)::FLOAT, cos(i*0.229+20)::FLOAT, sin(i*0.239+21)::FLOAT, cos(i*0.249+22)::FLOAT,
   sin(i*0.259+23)::FLOAT, cos(i*0.269+24)::FLOAT, sin(i*0.279+25)::FLOAT, cos(i*0.289+26)::FLOAT,
   sin(i*0.299+27)::FLOAT, cos(i*0.309+28)::FLOAT, sin(i*0.319+29)::FLOAT, cos(i*0.329+30)::FLOAT
  ]::FLOAT[32] AS vec
FROM range(20001, 25001) t(i);

statement ok
DROP TABLE bf_s;

statement ok
CREATE TABLE bf_s AS SELECT id FROM recall_strong
ORDER BY l2_distance(vec, [0.3,-0.5,0.7,-0.2,0.4,-0.6,0.8,-0.1,0.5,-0.3,0.6,-0.4,0.2,-0.7,0.9,-0.8,0.1,-0.9,0.35,-0.15,0.55,-0.45,0.25,-0.65,0.85,-0.75,0.05,-0.95,0.42,-0.32,0.62,-0.52]::FLOAT[32]) LIMIT 10;


query I
SELECT COUNT(*) >= 8 FROM (
  SELECT id FROM recall_strong
  ORDER BY l2_distance(vec, [0.3,-0.5,0.7,-0.2,0.4,-0.6,0.8,-0.1,0.5,-0.3,0.6,-0.4,0.2,-0.7,0.9,-0.8,0.1,-0.9,0.35,-0.15,0.55,-0.45,0.25,-0.65,0.85,-0.75,0.05,-0.95,0.42,-0.32,0.62,-0.52]::FLOAT[32]) LIMIT 10
) ann WHERE ann.id IN (SELECT id FROM bf_s);
----
true

# ============================================================
# Cleanup
# ============================================================
statement ok
DROP TABLE bf_s;

statement ok
DROP TABLE recall_strong;
