# name: test/sql/vex/index/graph_index_metric_ip.test
# description: Inner product metric — comprehensive tests
# group: [vex]
#
# Inner product metric: -dot(a,b) as HNSW distance.
# ORDER BY inner_product(vec, q) DESC = find highest IP first.
# Tests cover: self-search, negative values, zero vectors, large magnitudes,
# recall quality, mutations, restart persistence, and edge cases.

require vex

# ============================================================
# Test 1: IP with negative vectors
# inner_product([1,0,0], [-1,0,0]) = -1 (least similar)
# inner_product([1,0,0], [10,0,0]) = 10 (most similar)
# ============================================================

statement ok
CREATE TABLE t_ip_neg (id INTEGER, vec FLOAT[3]);

statement ok
INSERT INTO t_ip_neg VALUES
  (1, [10.0, 0.0, 0.0]::FLOAT[3]),
  (2, [1.0, 0.0, 0.0]::FLOAT[3]),
  (3, [0.0, 0.0, 0.0]::FLOAT[3]),
  (4, [-1.0, 0.0, 0.0]::FLOAT[3]),
  (5, [-10.0, 0.0, 0.0]::FLOAT[3]);

statement ok
CREATE INDEX idx_ip_neg ON t_ip_neg USING GRAPH_INDEX (vec) WITH (metric='ip');

# Highest IP first: id=1(10), id=2(1), id=3(0), id=4(-1), id=5(-10)
query I
SELECT id FROM t_ip_neg ORDER BY inner_product(vec, [1.0, 0.0, 0.0]::FLOAT[3]) DESC LIMIT 3;
----
1
2
3

query I
SELECT node_count <= row_id_map_size FROM vex_index_info() WHERE index_name = 'idx_ip_neg';
----
true

statement ok
DROP TABLE t_ip_neg;

# ============================================================
# Test 2: IP with large magnitudes (numerical stability)
# ============================================================

statement ok
CREATE TABLE t_ip_large (id INTEGER, vec FLOAT[4]);

statement ok
INSERT INTO t_ip_large VALUES
  (1, [1e5, 1e5, 0.0, 0.0]::FLOAT[4]),
  (2, [1e3, 1e3, 0.0, 0.0]::FLOAT[4]),
  (3, [1.0, 1.0, 0.0, 0.0]::FLOAT[4]),
  (4, [0.001, 0.001, 0.0, 0.0]::FLOAT[4]),
  (5, [1e5, 0.0, 1e5, 0.0]::FLOAT[4]);

statement ok
CREATE INDEX idx_ip_large ON t_ip_large USING GRAPH_INDEX (vec) WITH (metric='ip');

# Query [1,1,0,0]: id=1(2e5), id=5(1e5), id=2(2e3), id=3(2), id=4(0.002)
query I
SELECT id FROM t_ip_large ORDER BY inner_product(vec, [1.0, 1.0, 0.0, 0.0]::FLOAT[4]) DESC LIMIT 3;
----
1
5
2

statement ok
DROP TABLE t_ip_large;

# ============================================================
# Test 3: IP with zero vectors
# inner_product(zero, anything) = 0
# ============================================================

statement ok
CREATE TABLE t_ip_zero (id INTEGER, vec FLOAT[3]);

statement ok
INSERT INTO t_ip_zero VALUES
  (1, [0.0, 0.0, 0.0]::FLOAT[3]),
  (2, [1.0, 0.0, 0.0]::FLOAT[3]),
  (3, [0.0, 1.0, 0.0]::FLOAT[3]);

statement ok
CREATE INDEX idx_ip_zero ON t_ip_zero USING GRAPH_INDEX (vec) WITH (metric='ip');

# Should not crash
query I
SELECT count(*) FROM (
  SELECT id FROM t_ip_zero
  ORDER BY inner_product(vec, [1.0, 0.0, 0.0]::FLOAT[3]) DESC
  LIMIT 3
);
----
3

query I
SELECT node_count <= row_id_map_size FROM vex_index_info() WHERE index_name = 'idx_ip_zero';
----
true

statement ok
DROP TABLE t_ip_zero;

# ============================================================
# Test 4: IP at scale — invariant + search quality
# Note: IP self-search does NOT guarantee finding itself (unlike L2/cosine),
# because ip(v, w) can exceed ip(v, v) when w is colinear with larger magnitude.
# Instead, we verify invariants and that search returns correct count.
# ============================================================

statement ok
CREATE TABLE t_ip_scale (id INTEGER, vec FLOAT[4]);

statement ok
INSERT INTO t_ip_scale SELECT i, list_value(
  (i * sin(i * 0.5))::FLOAT,
  (i * cos(i * 0.5))::FLOAT,
  (i * sin(i * 1.3))::FLOAT,
  (i * cos(i * 1.3))::FLOAT
)::FLOAT[4]
FROM range(1, 201) t(i);

statement ok
CREATE INDEX idx_ip_scale ON t_ip_scale USING GRAPH_INDEX (vec) WITH (metric='ip');

query I
SELECT node_count <= row_id_map_size FROM vex_index_info() WHERE index_name = 'idx_ip_scale';
----
true

# Search returns correct number of results
query I
SELECT count(*) FROM (
  SELECT id FROM t_ip_scale
  ORDER BY inner_product(vec, [1.0, 1.0, 1.0, 1.0]::FLOAT[4]) DESC
  LIMIT 20
);
----
20

# Top-1 for query [1,0,0,0]: should be the row with largest x-component
# Row i has x = i*sin(i*0.5). The largest IP is dominated by large i * favorable direction.
# We just verify the result is sensible (id > 100, since large i = large magnitude)
query I
SELECT id > 100 FROM (
  SELECT id FROM t_ip_scale
  ORDER BY inner_product(vec, [1.0, 0.0, 0.0, 0.0]::FLOAT[4]) DESC
  LIMIT 1
);
----
true

statement ok
DROP TABLE t_ip_scale;

# ============================================================
# Test 5: IP recall@10 vs brute-force
# ============================================================

statement ok
CREATE TABLE t_ip_recall (id INTEGER, vec FLOAT[8]);

statement ok
INSERT INTO t_ip_recall SELECT i, list_value(
  (i * sin(i*0.1))::FLOAT, (i * cos(i*0.1))::FLOAT,
  (i * sin(i*0.2))::FLOAT, (i * cos(i*0.2))::FLOAT,
  (i * sin(i*0.3))::FLOAT, (i * cos(i*0.3))::FLOAT,
  (i * sin(i*0.4))::FLOAT, (i * cos(i*0.4))::FLOAT
)::FLOAT[8]
FROM range(1, 301) t(i);

# Brute-force top-10 (no index)
statement ok
CREATE TABLE t_ip_bf AS
SELECT id FROM t_ip_recall
ORDER BY inner_product(vec, [1.0,1.0,1.0,1.0,1.0,1.0,1.0,1.0]::FLOAT[8]) DESC
LIMIT 10;

statement ok
CREATE INDEX idx_ip_recall ON t_ip_recall USING GRAPH_INDEX (vec) WITH (metric='ip', ef_construction=200);

# Use high ef_search for stable recall
statement ok
SET vex_ef_search = 200;

# Index top-10
statement ok
CREATE TABLE t_ip_idx AS
SELECT id FROM t_ip_recall
ORDER BY inner_product(vec, [1.0,1.0,1.0,1.0,1.0,1.0,1.0,1.0]::FLOAT[8]) DESC
LIMIT 10;

# Recall >= 80%
query I
SELECT count(*) >= 8 FROM t_ip_bf WHERE id IN (SELECT id FROM t_ip_idx);
----
true

statement ok
DROP TABLE t_ip_bf;

statement ok
DROP TABLE t_ip_idx;

statement ok
DROP TABLE t_ip_recall;

# ============================================================
# Test 6: IP DELETE + UPDATE + INSERT cycle
# ============================================================

statement ok
CREATE TABLE t_ip_mut (id INTEGER, vec FLOAT[4]);

statement ok
INSERT INTO t_ip_mut SELECT i, list_value(
  sin(i*0.1)::FLOAT, cos(i*0.1)::FLOAT,
  sin(i*0.2)::FLOAT, cos(i*0.2)::FLOAT
)::FLOAT[4]
FROM range(1, 101) t(i);

statement ok
CREATE INDEX idx_ip_mut ON t_ip_mut USING GRAPH_INDEX (vec) WITH (metric='ip');

# DELETE 30
statement ok
DELETE FROM t_ip_mut WHERE id <= 30;

query I
SELECT node_count <= row_id_map_size FROM vex_index_info() WHERE index_name = 'idx_ip_mut';
----
true

# UPDATE 20
statement ok
UPDATE t_ip_mut SET vec = [100.0, 0.0, 0.0, 0.0]::FLOAT[4] WHERE id BETWEEN 31 AND 50;

query I
SELECT node_count <= row_id_map_size FROM vex_index_info() WHERE index_name = 'idx_ip_mut';
----
true

# INSERT 50 with large magnitudes
statement ok
INSERT INTO t_ip_mut SELECT i, list_value(
  (i * 50.0)::FLOAT, 0.0, 0.0, 0.0
)::FLOAT[4]
FROM range(101, 151) t(i);

query I
SELECT node_count <= row_id_map_size FROM vex_index_info() WHERE index_name = 'idx_ip_mut';
----
true

# The updated rows (id 31-50 with vec=[100,0,0,0]) should rank high for query [1,0,0,0]
query I
SELECT count(*) FROM (
  SELECT id FROM t_ip_mut
  ORDER BY inner_product(vec, [1.0, 0.0, 0.0, 0.0]::FLOAT[4]) DESC
  LIMIT 10
);
----
10

# Verify deleted rows don't appear
query I
SELECT count(*) FROM (
  SELECT id FROM t_ip_mut
  ORDER BY inner_product(vec, [1.0, 0.0, 0.0, 0.0]::FLOAT[4]) DESC
  LIMIT 120
) sub
WHERE sub.id <= 30;
----
0

statement ok
DROP TABLE t_ip_mut;

# ============================================================
# Test 7: IP metric restart persistence
# ============================================================

load __TEST_DIR__/ip_metric_restart.db

statement ok
CREATE TABLE t_ip_r (id INTEGER, vec FLOAT[4]);

statement ok
INSERT INTO t_ip_r SELECT i, list_value(
  (i * sin(i))::FLOAT, (i * cos(i))::FLOAT, 0.1, 0.2
)::FLOAT[4]
FROM range(1, 101) t(i);

statement ok
CREATE INDEX idx_ip_r ON t_ip_r USING GRAPH_INDEX (vec) WITH (metric='ip');

statement ok
CHECKPOINT;

restart

# Search after restart
query I
SELECT count(*) FROM (
  SELECT id FROM t_ip_r
  ORDER BY inner_product(vec, [1.0, 0.0, 0.0, 0.0]::FLOAT[4]) DESC
  LIMIT 10
);
----
10

# INSERT after restart
statement ok
INSERT INTO t_ip_r SELECT i, list_value(
  (i * 1000.0)::FLOAT, 0.0, 0.0, 0.0
)::FLOAT[4]
FROM range(101, 121) t(i);

query I
SELECT node_count <= row_id_map_size FROM vex_index_info() WHERE index_name = 'idx_ip_r';
----
true

# DELETE after restart
statement ok
DELETE FROM t_ip_r WHERE id <= 20;

query I
SELECT node_count <= row_id_map_size FROM vex_index_info() WHERE index_name = 'idx_ip_r';
----
true

# Checkpoint + restart again
statement ok
CHECKPOINT;

restart

# Still works after double restart
statement ok
DELETE FROM t_ip_r WHERE id = -999;

query I
SELECT node_count <= row_id_map_size FROM vex_index_info() WHERE index_name = 'idx_ip_r';
----
true

query I
SELECT count(*) FROM (
  SELECT id FROM t_ip_r
  ORDER BY inner_product(vec, [1.0, 1.0, 0.0, 0.0]::FLOAT[4]) DESC
  LIMIT 10
);
----
10

statement ok
DROP TABLE t_ip_r;

# ============================================================
# Test 8: Metric mismatch — IP index rejects cosine/L2 queries
# (optimizer fallback to brute-force, results still correct)
# ============================================================

statement ok
CREATE TABLE t_ip_mm (id INTEGER, vec FLOAT[3]);

statement ok
INSERT INTO t_ip_mm VALUES
  (1, [1.0, 0.0, 0.0]::FLOAT[3]),
  (2, [0.0, 1.0, 0.0]::FLOAT[3]),
  (3, [0.0, 0.0, 1.0]::FLOAT[3]);

statement ok
CREATE INDEX idx_ip_mm ON t_ip_mm USING GRAPH_INDEX (vec) WITH (metric='ip');

# L2 query on IP index — optimizer skips, brute-force used
query I
SELECT id FROM t_ip_mm ORDER BY l2_distance(vec, [1.0, 0.0, 0.0]::FLOAT[3]) LIMIT 1;
----
1

# Cosine query on IP index — optimizer skips, brute-force used
query I
SELECT id FROM t_ip_mm ORDER BY cosine_distance(vec, [1.0, 0.0, 0.0]::FLOAT[3]) LIMIT 1;
----
1

statement ok
DROP TABLE t_ip_mm;

